{
  "apiVersion": "hairness.dev/distribution/v1alpha1",
  "kind": "Distribution",
  "metadata": {
    "id": "hairness/standard",
    "version": "0.3.0-alpha.0",
    "summary": "The recommended Hairness composition for codebase work and delivery."
  },
  "spec": {
    "extensions": ["hairness/cockpit", "hairness/work", "hairness/sources", "hairness/codebase", "hairness/delivery"],
    "defaults": { "providers": ["codex"], "overlaySnapshot": "boundary" },
    "policies": [],
    "onboarding": []
  }
}
